{
  "contract_version": "1.0.0",
  "model_version": "v1.0.0",
  "evaluated_at": "2026-10-23T20:25:17.360860+00:00",
  "generator_seed": 42,
  "results": [
    {
      "metric_key": "genai_verifier_injected_error_catch_rate",
      "module": "genai",
      "dataset_origin": "synthetic",
      "value": 1.0,
      "ci_low": 1.0,
      "ci_high": 1.0,
      "passed_bar": true,
      "notes": "value = min(a, b). (a) own fuzz 500/500 (own generator, not independent); (b) reviewer-written independent set 47/47 (missed: none; fullwidth-digit case excluded as NFKC-equal numbers); (c) second 100-case set by Agent E 100/100 (still passing: none). Not a proof of completeness."
    },
    {
      "metric_key": "genai_unverified_reports_shipped",
      "module": "genai",
      "dataset_origin": "synthetic",
      "value": 0.0,
      "ci_low": 0.0,
      "ci_high": 0.0,
      "passed_bar": true,
      "notes": "n=1000 generated reports with FakeClient good/bad mixture; llm_accepted=692, template_fallbacks=308."
    }
  ]
}