{
 "contract_version": "1.0.0",
 "model_version": "v1.1.0",
 "evaluated_at": "2026-10-24T00:00:00Z",
 "generator_seed": 42,
 "results": [
  {
   "metric_key": "irt_theta_r_rasch",
   "module": "irt",
   "dataset_origin": "synthetic",
   "value": 0.5312746404271455,
   "ci_low": 0.4869787285113736,
   "ci_high": 0.5531670808550019,
   "passed_bar": false,
   "notes": "mean over 4 institutes (ci = min/max); Rasch MAP, cells with n>=5; informal bar 0.8"
  },
  {
   "metric_key": "irt_theta_r_rawpct",
   "module": "irt",
   "dataset_origin": "synthetic",
   "value": 0.4883370584902001,
   "ci_low": 0.45642904025073383,
   "ci_high": 0.52134351701606,
   "passed_bar": false,
   "notes": "mean over 4 institutes (ci = min/max); Rasch MAP, cells with n>=5; informal bar None"
  },
  {
   "metric_key": "irt_b_r",
   "module": "irt",
   "dataset_origin": "synthetic",
   "value": 0.7918001413263369,
   "ci_low": 0.6634337293392678,
   "ci_high": 0.8996520395742791,
   "passed_bar": false,
   "notes": "mean over 4 institutes (ci = min/max); Rasch MAP, cells with n>=5; informal bar 0.9"
  },
  {
   "metric_key": "irt_wrongkey_recall",
   "module": "irt",
   "dataset_origin": "synthetic",
   "value": 0.75,
   "ci_low": 0.0,
   "ci_high": 1.0,
   "passed_bar": true,
   "notes": "mean over 4 institutes (ci = min/max); Rasch MAP, cells with n>=5; informal bar 0.7"
  },
  {
   "metric_key": "irt_wrongkey_precision",
   "module": "irt",
   "dataset_origin": "synthetic",
   "value": 0.75,
   "ci_low": 0.0,
   "ci_high": 1.0,
   "passed_bar": false,
   "notes": "mean over 4 institutes (ci = min/max); Rasch MAP, cells with n>=5; informal bar None"
  },
  {
   "metric_key": "risk_academic_lgbm_precision",
   "module": "early_warning",
   "dataset_origin": "synthetic",
   "value": 0.08260869565217391,
   "ci_low": null,
   "ci_high": null,
   "passed_bar": false,
   "notes": "test = 2026 cohort, 3 as-of dates, horizon 45 days, capacity 5% of active students"
  },
  {
   "metric_key": "risk_academic_lgbm_recall",
   "module": "early_warning",
   "dataset_origin": "synthetic",
   "value": 0.1130952380952381,
   "ci_low": null,
   "ci_high": null,
   "passed_bar": false,
   "notes": "test = 2026 cohort, 3 as-of dates, horizon 45 days, capacity 5% of active students"
  },
  {
   "metric_key": "risk_academic_lgbm_lead_time_days",
   "module": "early_warning",
   "dataset_origin": "synthetic",
   "value": 15.684999999999999,
   "ci_low": null,
   "ci_high": null,
   "passed_bar": false,
   "notes": "test = 2026 cohort, 3 as-of dates, horizon 45 days, capacity 5% of active students"
  },
  {
   "metric_key": "risk_academic_lgbm_auc",
   "module": "early_warning",
   "dataset_origin": "synthetic",
   "value": 0.6680434322323306,
   "ci_low": null,
   "ci_high": null,
   "passed_bar": false,
   "notes": "test = 2026 cohort, 3 as-of dates, horizon 45 days, capacity 5% of active students"
  },
  {
   "metric_key": "risk_full_lgbm_precision",
   "module": "early_warning",
   "dataset_origin": "synthetic",
   "value": 0.3217391304347826,
   "ci_low": null,
   "ci_high": null,
   "passed_bar": false,
   "notes": "test = 2026 cohort, 3 as-of dates, horizon 45 days, capacity 5% of active students"
  },
  {
   "metric_key": "risk_full_lgbm_recall",
   "module": "early_warning",
   "dataset_origin": "synthetic",
   "value": 0.44047619047619047,
   "ci_low": null,
   "ci_high": null,
   "passed_bar": false,
   "notes": "test = 2026 cohort, 3 as-of dates, horizon 45 days, capacity 5% of active students"
  },
  {
   "metric_key": "risk_full_lgbm_lead_time_days",
   "module": "early_warning",
   "dataset_origin": "synthetic",
   "value": 14.297879041967663,
   "ci_low": null,
   "ci_high": null,
   "passed_bar": false,
   "notes": "test = 2026 cohort, 3 as-of dates, horizon 45 days, capacity 5% of active students"
  },
  {
   "metric_key": "risk_full_lgbm_auc",
   "module": "early_warning",
   "dataset_origin": "synthetic",
   "value": 0.812263339070568,
   "ci_low": null,
   "ci_high": null,
   "passed_bar": false,
   "notes": "test = 2026 cohort, 3 as-of dates, horizon 45 days, capacity 5% of active students"
  },
  {
   "metric_key": "risk_b2_ranked_attendance_precision",
   "module": "early_warning",
   "dataset_origin": "synthetic",
   "value": 0.22826086956521738,
   "ci_low": null,
   "ci_high": null,
   "passed_bar": false,
   "notes": "test = 2026 cohort, 3 as-of dates, horizon 45 days, capacity 5% of active students"
  },
  {
   "metric_key": "risk_b2_ranked_attendance_recall",
   "module": "early_warning",
   "dataset_origin": "synthetic",
   "value": 0.3125,
   "ci_low": null,
   "ci_high": null,
   "passed_bar": false,
   "notes": "test = 2026 cohort, 3 as-of dates, horizon 45 days, capacity 5% of active students"
  },
  {
   "metric_key": "risk_b2_ranked_attendance_lead_time_days",
   "module": "early_warning",
   "dataset_origin": "synthetic",
   "value": 13.567281840966052,
   "ci_low": null,
   "ci_high": null,
   "passed_bar": false,
   "notes": "test = 2026 cohort, 3 as-of dates, horizon 45 days, capacity 5% of active students"
  },
  {
   "metric_key": "risk_b2_ranked_attendance_auc",
   "module": "early_warning",
   "dataset_origin": "synthetic",
   "value": 0.7418903505177171,
   "ci_low": null,
   "ci_high": null,
   "passed_bar": false,
   "notes": "test = 2026 cohort, 3 as-of dates, horizon 45 days, capacity 5% of active students"
  },
  {
   "metric_key": "risk_b1_attendance_rule_precision",
   "module": "early_warning",
   "dataset_origin": "synthetic",
   "value": 0.09164059007599464,
   "ci_low": null,
   "ci_high": null,
   "passed_bar": false,
   "notes": "test = 2026 cohort, 3 as-of dates, horizon 45 days, capacity 5% of active students"
  },
  {
   "metric_key": "risk_b1_attendance_rule_recall",
   "module": "early_warning",
   "dataset_origin": "synthetic",
   "value": 0.6101190476190477,
   "ci_low": null,
   "ci_high": null,
   "passed_bar": false,
   "notes": "test = 2026 cohort, 3 as-of dates, horizon 45 days, capacity 5% of active students"
  },
  {
   "metric_key": "risk_b1_attendance_rule_flagged_share",
   "module": "early_warning",
   "dataset_origin": "synthetic",
   "value": 0.24715501049607777,
   "ci_low": null,
   "ci_high": null,
   "passed_bar": false,
   "notes": "test = 2026 cohort, 3 as-of dates, horizon 45 days, capacity 5% of active students"
  },
  {
   "metric_key": "risk_ece_full",
   "module": "early_warning",
   "dataset_origin": "synthetic",
   "value": 0.004862744099449785,
   "ci_low": null,
   "ci_high": null,
   "passed_bar": false,
   "notes": "decile calibration error"
  },
  {
   "metric_key": "risk_base_rate",
   "module": "early_warning",
   "dataset_origin": "synthetic",
   "value": 0.037122969837587005,
   "ci_low": null,
   "ci_high": null,
   "passed_bar": false,
   "notes": "45-day dropout rate in test snapshots"
  },
  {
   "metric_key": "percentile_conformal_coverage",
   "module": "percentile_band",
   "dataset_origin": "synthetic",
   "value": 0.799755426475084,
   "ci_low": null,
   "ci_high": null,
   "passed_bar": true,
   "notes": "target 0.80; calibrated on 2025, tested on 2026; truth = synthetic outcome incl. shift difficulty"
  },
  {
   "metric_key": "percentile_band_halfwidth",
   "module": "percentile_band",
   "dataset_origin": "synthetic",
   "value": 3.434851976685657,
   "ci_low": null,
   "ci_high": null,
   "passed_bar": false,
   "notes": "percentile points, half width"
  },
  {
   "metric_key": "percentile_point_mae",
   "module": "percentile_band",
   "dataset_origin": "synthetic",
   "value": 2.473215009529538,
   "ci_low": null,
   "ci_high": null,
   "passed_bar": false,
   "notes": "point model MAE (no interval)"
  },
  {
   "metric_key": "moat_rmse_1_institute",
   "module": "robustness",
   "dataset_origin": "synthetic",
   "value": 0.22068554564804366,
   "ci_low": 0.1850308600820706,
   "ci_high": 0.24282821667593338,
   "passed_bar": false,
   "notes": ""
  },
  {
   "metric_key": "moat_rmse_20_institutes",
   "module": "robustness",
   "dataset_origin": "synthetic",
   "value": 0.16457587128887938,
   "ci_low": 0.14304838428980812,
   "ci_high": 0.18241881087118342,
   "passed_bar": false,
   "notes": ""
  },
  {
   "metric_key": "genai_reports_unverified_shipped",
   "module": "genai",
   "dataset_origin": "synthetic",
   "value": 0.0,
   "ci_low": null,
   "ci_high": null,
   "passed_bar": true,
   "notes": "reports.json contains only verified reports (template path)"
  }
 ]
}